question,answer
"If a student has to stay home (flu symptoms, for example), what are the strategies to support remote learning?","It is expected that we may have higher than normal absenteeism this semester, particularly in the first few weeks of classes. Instructors will do their best to be understanding of students’ situations. Any resources or supplemental information that can be shared via Blackboard or other means may be available to students who have to miss class due to illness or isolation requirements.   Remember that decisions regarding attendance are the discretion of individual instructors, and faculty are encouraged to be reasonable when dealing with absences. Students continue to have the responsibility to communicate when illness impacts their ability to meet the requirements of a class. These are further resources in case you miss a class.  "
"If I am sick, are there alternatives to attend class/take exams online?","Decision regarding attendance is the discretion of individual instructors, and faculty are encouraged to be reasonable when dealing with absences. Students continue to have the responsibility to communicate when illness impacts their ability to meet the requirements of a class.   It is expected that we may have higher than normal absenteeism this semester, particularly in the first few weeks of classes. Instructors will do their best to be understanding of students’ situations. Any resources or supplemental information that can be shared via Blackboard or other means may be available to students who have to miss class due to illness or isolation requirements.   Remember that decisions regarding attendance are the discretion of individual instructors, and faculty are encouraged to be reasonable when dealing with absences. Students continue to have the responsibility to communicate when illness impacts their ability to meet the requirements of a class. These are further resources in case you miss a class."
Will there be more options for online learning moving forward if I want to delay my return to campus or have moved outside the Lower Mainland?,"While Douglas College is returning to primarily in-person learning and service delivery model, the proportion of online classes is much higher than before the pandemic."
Will I be able to access online classes / recordings if I am unable to attend an in-person class?,"Not necessarily. Students should not have the expectation that alternative learning resources will be available for in-person courses if they're unable to attend class. If you're sick, speak with your instructor."
Can an ill student ask a classmate to audio/video record a class for them?,"No, recording a class is not permitted without prior authorization by the instructor and must follow the privacy policy of the College."
