question,answer
What happens if I am unable to take my final exam?,"If you are unable to take your final exam, review your instructor's course policy regarding exams and notify your instructor of your absence. Based on your instructor's approval, alternative arrangements for your final exam may be provided."
Can my final exam be rescheduled if I have a conflict?,"Yes. Final Examinations will be rescheduled for any student with two or more examinations at the same time, or three or more examinations within a 24-hour period. Your instructor should contact you, but if they do not, inform them of your conflict."
How much travel time is given between final exams at different campuses?,Students will be provided a minimum of two hours travel time between final examinations scheduled at two different campuses. The instructor or department of the second examination will accommodate the student.
Will final exams be rescheduled for reasons other than conflicts?,Final examinations will not be rescheduled for reasons other than those noted in the college policy (conflicting exam times or three or more exams in 24 hours).
Where can I find the final exam schedule?,The final exam schedule is published on the Douglas College website under Current Students > Important Dates and Information > Exam Schedule.
What should I do if my instructor does not contact me about an exam conflict?,"If you have an exam conflict that qualifies for rescheduling and your instructor has not contacted you, inform your instructor directly that you have an exam conflict so they can work with you to resolve it."
How many exams within 24 hours qualify for rescheduling?,"If you have three or more examinations within a 24-hour period (e.g., from 8:30 a.m. to 8:29 a.m. the following day), you qualify to have your exam conflict resolved."
Can I view the final exam schedule before it is officially published?,The exam schedule is published at a set time each semester. Check the Douglas College website or myAccount for the most current exam schedule information.
What do I do if I arrive late to a final exam?,Contact your instructor or the relevant department immediately. Policies for late arrivals may vary by instructor and course. Review your course outline for specific instructions.
